Card Name,Type,Mana Cost,Color Identity,Powep,Toughness,Abilities/Effects,Rarity,Set/Edition,Scryfall ID
Jace's Scrutiny,Instant,{1}{U},['U'],,,"Target creature gets -4/-0 until end of turn.
Investigate. (Create a Clue token. It's an artifact with ""{2}, Sacrifice this artifact: Draw a card."")",common,soi,3d0eea0d-c790-4d91-962f-f05b22d0c8fa
"Jace, Architect of Thought",Legendary Planeswalker — Jace,{2}{U}{U},['U'],,,"+1: Until your next turn, whenever a creature an opponent controls attacks, it gets -1/-0 until end of turn.
−2: Reveal the top three cards of your library. An opponent separates those cards into two piles. Put one pile into your hand and the other on the bottom of your library in any order.
−8: For each player, search that player's library for a nonland card and exile it, then that player shuffles. You may cast those cards without paying their mana costs.",mythic,cmm,7051cdfa-509e-4d84-bbae-f77556c861e4
Lamplighter of Selhoff,Creature — Zombie Horror,{4}{U},['U'],3,5,"When Lamplighter of Selhoff enters, if you control another Zombie, you may draw a card. If you do, discard a card.",common,soi,80dadecc-f1f1-44a2-8829-6c94aade73a0
Leapfrog,Creature — Frog,{2}{U},['U'],3,1,Leapfrog has flying as long as you've cast an instant or sorcery spell this turn.,common,clu,0eefa088-cc53-41a4-b5ad-88483915cd8f
Learn from the Past,Instant,{3}{U},['U'],,,"Target player shuffles their graveyard into their library.
Draw a card.",uncommon,dtk,347c6e76-dba4-4448-a4f4-d9591d4539c7
Living Tempest,Creature — Elemental,{4}{U},['U'],3,3,"Flash
Flying",common,znr,a05ed233-9b53-4c67-ab1c-0217386c9fe4
Lost in a Labyrinth,Instant,{U},['U'],,,Target creature gets -3/-0 until end of turn. Scry 1. (Look at the top card of your library. You may put that card on the bottom.),common,ths,09aa7744-680f-4c2a-8fa0-9cb0c176ae8f
Lunar Force,Enchantment,{2}{U},['U'],,,"When an opponent casts a spell, sacrifice Lunar Force and counter that spell.",uncommon,emn,76614db3-480f-41f6-91ad-66301fc8e394
Malfunction,Enchantment — Aura,{3}{U},['U'],,,"Enchant artifact or creature
When Malfunction enters, tap enchanted permanent.
Enchanted permanent doesn't untap during its controller's untap step.",common,kld,c41f907f-4512-4c5d-827b-fef04613d641
Mana Leak,Instant,{1}{U},['U'],,,Counter target spell unless its controller pays {3}.,common,2x2,179236d9-6fe2-4db6-bdfb-f851e8d531a2
Mantle of Tides,Artifact — Equipment,{U},['U'],,,"Equipped creature gets +1/+2.
Whenever you draw your second card each turn, attach Mantle of Tides to target creature you control.
Equip {3} ({3}: Attach to target creature you control. Equip only as a sorcery.)",common,eld,c058d01e-f705-4407-bd9e-a2d127afdf04
Maze Glider,Creature — Elemental,{5}{U},['U'],3,5,"Flying
Multicolored creatures you control have flying.",common,dgm,d1d20281-49c0-4fd0-91f2-390506ac33f6
Merfolk Mesmerist,Creature — Merfolk Wizard,{1}{U},['U'],1,2,"{U}, {T}: Target player mills two cards.",common,m12,220dede5-472c-4a09-bdf0-73e722d9d4d2
Merfolk Secretkeeper // Venture Deeper,Creature — Merfolk Wizard // Sorcery — Adventure,{U} // {U},['U'],0,4,,common,eld,ceb7308d-608c-4ede-9496-d795fc5bb271
Mist Raven,Creature — Bird,{2}{U}{U},['U'],2,2,"Flying
When Mist Raven enters, return target creature to its owner's hand.",common,khc,8f868751-dd1a-4beb-b3cc-c4a88980299b
Mistform Seaswift,Creature — Illusion,{3}{U},['U'],3,1,"Flying
{1}: Mistform Seaswift becomes the creature type of your choice until end of turn.
Morph {1}{U} (You may cast this card face down as a 2/2 creature for {3}. Turn it face up any time for its morph cost.)",common,lgn,b2f6c73c-8162-499f-8d16-92f17c0c2bee
Mnemonic Wall,Creature — Wall,{4}{U},['U'],0,4,"Defender
When Mnemonic Wall enters, you may return target instant or sorcery card from your graveyard to your hand.",common,ima,a3e6784b-78e8-4f0b-8d27-d49c7cea9252
Mirrorshell Crab,Artifact Creature — Crab,{5}{U}{U},['U'],5,7,"Ward {3} (Whenever this creature becomes the target of a spell or ability an opponent controls, counter it unless that player pays {3}.)
Channel — {2}{U}, Discard Mirrorshell Crab: Counter target spell or ability unless its controller pays {3}.",common,neo,0394c8df-2e8a-4477-93b7-569934d7b936
Negate,Instant,{1}{U},['U'],,,Counter target noncreature spell.,common,ori,e848b632-e08a-4341-a99c-d8207f9ffe48
Negate,Instant,{1}{U},['U'],,,Counter target noncreature spell.,common,cn2,3d5e6fdf-022a-480d-96fc-bfadbf7ee5f6
Nephalia Smuggler,Creature — Human Rogue,{U},['U'],1,1,"{3}{U}, {T}: Exile another target creature you control, then return that card to the battlefield under your control.",uncommon,2x2,6e9a17b5-422c-4add-adbf-63e4492121e8
Nivix Barrier,Creature — Illusion Wall,{3}{U},['U'],0,4,"Flash (You may cast this spell any time you could cast an instant.)
Defender (This creature can't attack.)
When Nivix Barrier enters, target attacking creature gets -4/-0 until end of turn.",common,ori,0b9b968d-b0cc-411d-9366-8358be28aef2
Notion Rain,Sorcery,{1}{U}{B},"['B', 'U']",,,"Surveil 2, then draw two cards. Notion Rain deals 2 damage to you. (To surveil 2, look at the top two cards of your library, then put any number of them into your graveyard and the rest on top of your library in any order.)",common,mkc,66ed78c5-be23-4fcb-9143-e6574cd6ec68
Nightwhorl Hermit,Creature — Rat Rogue,{2}{U},['U'],1,4,"Vigilance
Threshold — As long as seven or more cards are in your graveyard, Nightwhorl Hermit gets +1/+0 and can't be blocked.",common,blb,0928e04f-2568-41e8-b603-7a25cf5f94d0
Ojutai Interceptor,Creature — Bird Soldier,{3}{U},['U'],3,1,"Flying
Megamorph {3}{U} (You may cast this card face down as a 2/2 creature for {3}. Turn it face up any time for its megamorph cost and put a +1/+1 counter on it.)",common,dtk,59a84666-ad2b-494c-b52b-ecee14788ef2
Ojutai's Summons,Sorcery,{3}{U}{U},['U'],,,"Create a 2/2 blue Djinn Monk creature token with flying.
Rebound (If you cast this spell from your hand, exile it as it resolves. At the beginning of your next upkeep, you may cast this card from exile without paying its mana cost.)",common,dtk,6769341a-1331-456d-a2bb-cd7fffe7b51d
One With the Wind,Enchantment — Aura,{1}{U},['U'],,,"Enchant creature
Enchanted creature gets +2/+2 and has flying.",common,xln,2c00f8bf-0088-44ad-b40b-26a2951a2428
Ongoing Investigation,Enchantment,{1}{U},['U'],,,"Whenever one or more creatures you control deal combat damage to a player, investigate. (Create a Clue token. It's an artifact with ""{2}, Sacrifice this artifact: Draw a card."")
{1}{G}, Exile a creature card from your graveyard: Investigate. You gain 2 life.",uncommon,mkc,ff084438-2e70-41bc-a208-30ab16c026c1
Opal Lake Gatekeepers,Creature — Vedalken Soldier,{3}{U},['U'],2,4,"When Opal Lake Gatekeepers enters, if you control two or more Gates, you may draw a card.",common,dgm,f43ac38f-5cd0-46cf-8623-d82cb8fb719b
Opt,Instant,{U},['U'],,,"Scry 1.
Draw a card.",common,otc,67bcf3fd-fca0-4cdb-b625-bac5fadd00e3
Paperfin Rascal,Creature — Merfolk Rogue,{2}{U},['U'],2,2,"When Paperfin Rascal enters, clash with an opponent. If you win, put a +1/+1 counter on Paperfin Rascal. (Each clashing player reveals the top card of their library, then puts that card on the top or bottom. A player wins if their card had a higher mana value.)",common,lrw,a439c0ca-0cb2-4293-825e-1a72159953b9
Passwall Adept,Creature — Human Wizard,{1}{U},['U'],1,3,{2}{U}: Target creature can't be blocked this turn.,common,grn,a8ed28c3-8c66-4883-8774-67ac5ab9e81c
Phantasmal Bear,Creature — Bear Illusion,{U},['U'],2,2,"When Phantasmal Bear becomes the target of a spell or ability, sacrifice it.",common,a25,d2a5e968-6ba4-44e9-9587-6ef456721b97
Pilfering Hawk,Snow Creature — Bird,{1}{U},['U'],1,2,"Flying
{S}, {T}: Draw a card, then discard a card. ({S} can be paid with one mana from a snow source.)",common,khm,76ee3829-8dec-4c0f-a6c2-ad47a1c94cfc
Possessed Skaab,Creature — Zombie,{3}{U}{B},"['B', 'U']",3,2,"When Possessed Skaab enters, return target instant, sorcery, or creature card from your graveyard to your hand.
If Possessed Skaab would die, exile it instead.",uncommon,ori,6ebc94e5-a595-43ab-929b-426009190669
Prescient Chimera,Creature — Chimera,{3}{U}{U},['U'],3,4,"Flying
Whenever you cast an instant or sorcery spell, scry 1. (Look at the top card of your library. You may put that card on the bottom.)",common,ths,f9342aba-e3aa-4210-ad72-e609c7c027b8
Press for Answers,Sorcery,{1}{U},['U'],,,"Tap target creature. It doesn't untap during its controller's next untap step.
Investigate. (Create a Clue token. It's an artifact with ""{2}, Sacrifice this artifact: Draw a card."")",common,soi,5ec8b8bf-7b02-4f5e-bbd3-9560f9888192
Protective Bubble,Enchantment — Aura,{3}{U},['U'],,,"Enchant creature
Enchanted creature can't be blocked and has shroud. (It can't be the target of spells or abilities.)",common,lrw,7ab1db58-66b6-4b92-9dcd-e044fa383469
Proven Combatant,Creature — Human Warrior,{U},['U'],1,1,"Eternalize {4}{U}{U} ({4}{U}{U}, Exile this card from your graveyard: Create a token that's a copy of it, except it's a 4/4 black Zombie Human Warrior with no mana cost. Eternalize only as a sorcery.)",common,hou,d83fd08a-c87b-4e29-bd1d-31dea3732156
Queen of Ice // Rage of Winter,Creature — Human Noble Wizard // Sorcery — Adventure,{2}{U} // {1}{U},['U'],2,3,,common,eld,de2f964a-e4e1-4321-92ad-34b781868e11
Quicksilver Geyser,Instant,{4}{U},['U'],,,Return up to two target nonland permanents to their owners' hands.,common,mbs,fb209cf5-ac7b-4521-b488-ef72451e3a25
Qarsi Deceiver,Creature — Snake Wizard,{1}{U},['U'],0,4,"{T}: Add {C}. Spend this mana only to cast a face-down creature spell, pay a mana cost to turn a manifested creature face up, or pay a morph cost. (A megamorph cost is a morph cost.)",uncommon,dtk,64d64264-895f-4d4d-8e5c-ab1d0d6e340b
Reality Acid,Enchantment — Aura,{2}{U},['U'],,,"Enchant permanent
Vanishing 3 (This Aura enters with three time counters on it. At the beginning of your upkeep, remove a time counter from it. When the last is removed, sacrifice it.)
When Reality Acid leaves the battlefield, enchanted permanent's controller sacrifices it.",common,tsr,a8510381-e05c-4cc4-98aa-c9327e18ec02
Refocus,Instant,{1}{U},['U'],,,"Untap target creature.
Draw a card.",common,frf,35c78973-f2ae-4c76-802f-793d1022fcbd
Riftwing Cloudskate,Creature — Illusion,{3}{U}{U},['U'],2,2,"Flying
When Riftwing Cloudskate enters, return target permanent to its owner's hand.
Suspend 3—{1}{U} (Rather than cast this card from your hand, you may pay {1}{U} and exile it with three time counters on it. At the beginning of your upkeep, remove a time counter. When the last is removed, you may cast it without paying its mana cost. It has haste.)",uncommon,tsr,1a2b228d-db4d-44a3-b208-6cf7a9f57da6
Ringwarden Owl,Creature — Bird,{3}{U}{U},['U'],3,3,"Flying (This creature can't be blocked except by creatures with flying or reach.)
Prowess (Whenever you cast a noncreature spell, this creature gets +1/+1 until end of turn.)",common,ori,1acf216d-ef8f-431b-9b65-1e2e91285517
Rise and Shine,Sorcery,{1}{U},['U'],,,"Target noncreature artifact you control becomes a 0/0 artifact creature. Put four +1/+1 counters on each artifact that became a creature this way.
Overload {4}{U}{U} (You may cast this spell for its overload cost. If you do, change ""target"" in its text to ""each."")",rare,moc,816716d6-4234-4570-9a64-cb3bef388095
Runewing,Creature — Bird,{3}{U},['U'],2,2,"Flying
When Runewing dies, draw a card.",common,rtr,749961e6-b135-4629-ae9d-124de0d70db9
Risen Riptide,Creature — Elemental,{2}{U},['U'],0,5,"Whenever you cast a kicked spell, Risen Riptide has base power and toughness 5/5 until end of turn.",common,znr,f6455009-030c-4a33-a60b-80863d8f8aaf
Run Ashore,Instant,{4}{U}{U},['U'],,,"Choose one or both —
• The owner of target nonland permanent puts it on the top or bottom of their library.
• Return target nonland permanent to its owner's hand.",common,khm,7eed5a2d-d7a4-4f64-a96b-04c5d4206c5a
Run Away Together,Instant,{1}{U},['U'],,,Choose two target creatures controlled by different players. Return those creatures to their owners' hands.,common,woc,000e88ab-f673-4822-bccb-a744f61060ef
Sage of the Falls,Creature — Merfolk Wizard,{4}{U},['U'],2,5,"Whenever Sage of the Falls or another non-Human creature you control enters, you may draw a card. If you do, discard a card.",uncommon,eld,274e3aa4-4b46-4daa-a7a8-400a20c59435
"Saheeli, Sublime Artificer",Legendary Planeswalker — Saheeli,{1}{U/R}{U/R},"['R', 'U']",,,"Whenever you cast a noncreature spell, create a 1/1 colorless Servo artifact creature token.
−2: Target artifact you control becomes a copy of another target artifact or creature you control until end of turn, except it's an artifact in addition to its other types.",uncommon,cmm,ce35a39a-6dcd-4bbc-b43b-bd1a5425cb05
Sentinels of Glen Elendra,Creature — Faerie Soldier,{3}{U},['U'],2,3,"Flash
Flying",common,lrw,f48daf7e-2f8e-4179-a145-a6b36dd11d44
Protect // Serve,Instant // Instant,{2}{W} // {1}{U},"['U', 'W']",,,,uncommon,dgm,9b8acd7d-f3e2-4358-91ab-40901b68d64c
"Sevinne, the Chronoclasm",Legendary Creature — Human Wizard,{2}{U}{R}{W},"['R', 'U', 'W']",2,2,"Prevent all damage that would be dealt to Sevinne, the Chronoclasm.
Whenever you cast your first instant or sorcery spell from your graveyard each turn, copy that spell. You may choose new targets for the copy.",mythic,c19,2c209efe-b4dc-44a3-bd45-d647f5680cbe
Sidisi's Faithful,Creature — Snake Wizard,{U},['U'],0,4,"Exploit (When this creature enters, you may sacrifice a creature.)
When Sidisi's Faithful exploits a creature, return target creature to its owner's hand.",common,dtk,d02daad9-701f-40d4-ad0b-44a3cbd32c3f
Siren's Ruse,Instant,{1}{U},['U'],,,"Exile target creature you control, then return that card to the battlefield under its owner's control. If a Pirate was exiled this way, draw a card.",common,xln,8f389872-d1f4-4828-a527-e820a6f2ac21
Skyclave Squid,Creature — Squid,{1}{U},['U'],3,2,"Defender
Landfall — Whenever a land you control enters, Skyclave Squid can attack this turn as though it didn't have defender.",common,znr,581ed049-7b5b-47d9-96af-f737631a221f
Skywinder Drake,Creature — Drake,{2}{U},['U'],3,1,"Flying
Skywinder Drake can block only creatures with flying.",common,m12,628213e9-bde9-43fd-a0d9-8c7fb17be879
Spellweaver Eternal,Creature — Zombie Snake Wizard,{1}{U},['U'],2,1,"Prowess (Whenever you cast a noncreature spell, this creature gets +1/+1 until end of turn.)
Afflict 2 (Whenever this creature becomes blocked, defending player loses 2 life.)",common,hou,a6bb7d1a-d606-46a8-a592-648c5d2e7382
Stonybrook Angler,Creature — Merfolk Wizard,{1}{U},['U'],1,2,"{1}{U}, {T}: You may tap or untap target creature.",common,lrw,047709e7-c44f-47e4-a9cc-1d941264e454
Strategic Planning,Sorcery,{1}{U},['U'],,,Look at the top three cards of your library. Put one of them into your hand and the rest into your graveyard.,common,khm,29306305-cb71-4fef-bf86-f5deb4e7e561
Streambed Aquitects,Creature — Merfolk Scout,{1}{U}{U},['U'],2,3,"{T}: Target Merfolk creature gets +1/+1 and gains islandwalk until end of turn. (It can't be blocked as long as defending player controls an Island.)
{T}: Target land becomes an Island until end of turn.",common,ddt,fdb6b1ae-db92-447f-943a-8d33de940d44
Sweep Away,Instant,{2}{U},['U'],,,"Return target creature to its owner's hand. If that creature is attacking, you may put it on top of its owner's library instead.",common,ogw,75234f6d-a2da-42dd-a668-8db8f341e7f0
Shell Shield,Instant,{U},['U'],,,"Kicker {1} (You may pay an additional {1} as you cast this spell.)
Target creature you control gets +0/+3 until end of turn. If this spell was kicked, that creature also gains hexproof until end of turn. (It can't be the target of spells or abilities your opponents control.)",common,znr,3daede39-8eef-4272-a483-312dbd2dd30f
Taigam's Strike,Sorcery,{3}{U},['U'],,,"Target creature gets +2/+0 until end of turn and can't be blocked this turn.
Rebound (If you cast this spell from your hand, exile it as it resolves. At the beginning of your next upkeep, you may cast this card from exile without paying its mana cost.)",common,dtk,2ef5e279-14c4-4f91-b24d-c7098140efcd
Tazeem Roilmage,Creature — Merfolk Wizard,{1}{U},['U'],2,1,"Kicker {4} (You may pay an additional {4} as you cast this spell.)
When Tazeem Roilmage enters, if it was kicked, return target instant or sorcery card from your graveyard to your hand.",common,znr,6f222fb7-375d-4ee2-9ff6-bd71f63ab31a
The Archimandrite,Legendary Creature — Human Advisor,{2}{U}{R}{W},"['R', 'U', 'W']",0,5,"At the beginning of your upkeep, you gain X life, where X is the number of cards in your hand minus 4.
Whenever you gain life, each Advisor, Artificer, and Monk you control gains vigilance and gets +X/+0 until end of turn, where X is the amount of life you gained.
Tap three untapped Advisors, Artificers, and/or Monks you control: Draw a card.",rare,brc,54fb3f4c-44fb-4afe-9fab-204ef98995c3
The Bath Song,Enchantment — Saga,{3}{U},['U'],,,"(As this Saga enters and after your draw step, add a lore counter. Sacrifice after III.)
I, II — Draw two cards, then discard a card.
III — Shuffle any number of target cards from your graveyard into your library. Add {U}{U}.",uncommon,ltr,fb11c04f-6f17-4da4-bbf6-0bd09de6e544
Thoughtbound Phantasm,Creature — Spirit,{U},['U'],2,2,"Defender
Whenever you surveil, put a +1/+1 counter on Thoughtbound Phantasm.
As long as Thoughtbound Phantasm has three or more +1/+1 counters on it, it can attack as though it didn't have defender.",uncommon,mkc,dbcdf292-a391-4452-8116-20084754f591
Tideshaper Mystic,Creature — Merfolk Wizard,{U},['U'],1,1,{T}: Target land becomes the basic land type of your choice until end of turn. Activate only during your turn.,common,lrw,e526ebbf-2041-4c3e-9a20-73bbf6f90251
Totally Lost,Instant,{4}{U},['U'],,,Put target nonland permanent on top of its owner's library.,common,rvr,c36f01a5-82bf-4fc6-9396-4410067c351b
Tower Geist,Creature — Spirit,{3}{U},['U'],2,2,"Flying
When Tower Geist enters, look at the top two cards of your library. Put one of them into your hand and the other into your graveyard.",uncommon,ddq,3304c2bc-2d05-497d-b92a-3de21a9d6b45
Unexplained Vision,Sorcery,{4}{U},['U'],,,"Draw three cards.
Adamant — If at least three blue mana was spent to cast this spell, scry 3.",common,eld,c1de1d84-e548-409d-b9ec-d2665477b43d
Unsummon,Instant,{U},['U'],,,Return target creature to its owner's hand.,common,m20,7a960516-3864-4a7a-8117-d25dec0dd665
Upheaval,Sorcery,{4}{U}{U},['U'],,,Return all permanents to their owners' hands.,rare,mh2,befe74b1-c487-42bb-a1a1-4d13f3a86ff7
Vantress Paladin,Creature — Human Knight,{3}{U},['U'],2,2,"Flying
Adamant — If at least three blue mana was spent to cast this spell, Vantress Paladin enters with a +1/+1 counter on it.",common,eld,52dd633f-9a07-47df-adb1-36013fc2f43a
Void Squall,Sorcery,{4}{U},['U'],,,"Return target nonland permanent to its owner's hand.
Rebound (If you cast this spell from your hand, exile it as it resolves. At the beginning of your next upkeep, you may cast this card from exile without paying its mana cost.)",uncommon,dtk,3d8a7aee-6403-44ce-a119-66147aa311fd
Warped Physique,Instant,{U}{B},"['B', 'U']",,,"Target creature gets +X/-X until end of turn, where X is the number of cards in your hand.",uncommon,gk1,30859a76-8ef6-4468-8e7c-fd21837d2a6c
Watcher in the Mist,Creature — Spirit,{3}{U}{U},['U'],3,4,"Flying
When Watcher in the Mist enters, surveil 2. (Look at the top two cards of your library, then put any number of them into your graveyard and the rest on top of your library in any order.)",common,clu,fd0c6c65-b4dc-4e4a-bbfe-6cf7cab5b48b
Wind Drake,Creature — Drake,{2}{U},['U'],2,2,Flying,common,kld,5e227a63-abea-494e-9d66-6ff0a3da14ca
Wishcoin Crab,Creature — Crab,{3}{U},['U'],2,5,,common,m21,348955a0-e988-48d7-a6a0-a8045fcffd25
Wishful Merfolk,Creature — Merfolk,{1}{U},['U'],3,2,"Defender
{1}{U}: Wishful Merfolk loses defender and becomes a Human until end of turn.",common,eld,f9358d5d-726e-43e0-a58e-4cfe7c755913
Whisper Agent,Creature — Human Rogue,{1}{U/B}{U/B},"['B', 'U']",3,2,"Flash
When Whisper Agent enters, surveil 1. (Look at the top card of your library. You may put it into your graveyard.)",common,clu,521d1016-6f80-49a2-a76b-59e86d3fae3e
Witching Well,Artifact,{U},['U'],,,"When Witching Well enters, scry 2. (Look at the top two cards of your library, then put any number of them on the bottom and the rest on top in any order.)
{3}{U}, Sacrifice Witching Well: Draw two cards.",common,cmm,d2f028cd-1cb4-4a5b-b989-4acd8777ac5c
Whirler Rogue,Creature — Human Rogue Artificer,{2}{U}{U},['U'],2,2,"When Whirler Rogue enters, create two 1/1 colorless Thopter artifact creature tokens with flying.
Tap two untapped artifacts you control: Target creature can't be blocked this turn.",uncommon,otc,d1054d2b-a424-466d-8ec6-36f014849e43
Zephyr Net,Enchantment — Aura,{1}{U},['U'],,,"Enchant creature
Enchanted creature has defender and flying.",common,lrw,817b8996-388f-4704-a4c8-ef99d4701805
Zulaport Duelist,Creature — Human Rogue,{U},['U'],1,1,"Flash
When Zulaport Duelist enters, up to one target creature gets -2/-0 until end of turn. Its controller mills two cards. (They put the top two cards of their library into their graveyard.)",common,znr,0b4c7268-60c6-4038-8ce9-d9d51bed4577
Pond Prophet,Creature — Frog Advisor,{G/U}{G/U},"['G', 'U']",1,1,"When Pond Prophet enters, draw a card.",common,blb,fb959e74-61ea-453d-bb9f-ad0183c0e1b1
Stormcatch Mentor,Creature — Otter Wizard,{U}{R},"['R', 'U']",1,1,"Haste
Prowess (Whenever you cast a noncreature spell, this creature gets +1/+1 until end of turn.)
Instant and sorcery spells you cast cost {1} less to cast.",uncommon,blb,99754055-6d67-4fde-aff3-41f6af6ea764
"Alania, Divergent Storm",Legendary Creature — Otter Wizard,{3}{U}{R},"['R', 'U']",3,5,"Whenever you cast a spell, if it's the first instant spell, the first sorcery spell, or the first Otter spell other than Alania you've cast this turn, you may have target opponent draw a card. If you do, copy that spell. You may choose new targets for the copy.",rare,blb,436d6a84-4cea-4ca7-94aa-9d08280652af
Azure Beastbinder,Creature — Rat Rogue,{1}{U},['U'],1,3,"Vigilance
Azure Beastbinder can't be blocked by creatures with power 2 or greater.
Whenever Azure Beastbinder attacks, up to one target artifact, creature, or planeswalker an opponent controls loses all abilities until your next turn. If it's a creature, it also has base power and toughness 2/2 until your next turn.",rare,blb,211af1bf-910b-41a5-b928-f378188d1871
Bellowing Crier,Creature — Frog Advisor,{1}{U},['U'],2,1,"When Bellowing Crier enters, draw a card, then discard a card.",common,blb,ca2215dd-6300-49cf-b9b2-3a840b786c31
Dazzling Denial,Instant,{1}{U},['U'],,,"Counter target spell unless its controller pays {2}. If you control a Bird, counter that spell unless its controller pays {4} instead.",common,blb,8739f1ac-2e57-4b52-a7ff-cc8df5936aad
Dire Downdraft,Instant,{3}{U},['U'],,,"This spell costs {1} less to cast if it targets an attacking or tapped creature.
Target creature's owner puts it on the top or bottom of their library.",common,blb,f1931f22-974c-43ad-911e-684bf3f9995d
Finch Formation,Creature — Bird Scout,{2}{U},['U'],2,2,"Offspring {3} (You may pay an additional {3} as you cast this spell. If you do, when this creature enters, create a 1/1 token copy of it.)
Flying
When this creature enters, target creature you control gains flying until end of turn.",common,blb,1c671eab-d1ef-4d79-94eb-8b85f0d18699
Kitnap,Enchantment — Aura,{2}{U}{U},['U'],,,"Gift a card (You may promise an opponent a gift as you cast this spell. If you do, when it enters, they draw a card.)
Enchant creature
When Kitnap enters, tap enchanted creature. If the gift wasn't promised, put three stun counters on it.
You control enchanted creature.",rare,blb,085be5d1-fd85-46d1-ad39-a8aa75a06a96
Lightshell Duo,Creature — Rat Otter,{3}{U},['U'],3,4,"Prowess (Whenever you cast a noncreature spell, this creature gets +1/+1 until end of turn.)
When Lightshell Duo enters, surveil 2. (Look at the top two cards of your library, then put any number of them into your graveyard and the rest on top of your library in any order.)",common,blb,2f00c834-b4a9-45b8-bb3f-22c2a42314a0
Otterball Antics,Sorcery,{1}{U},['U'],,,"Create a 1/1 blue and red Otter creature token with prowess. If this spell was cast from anywhere other than your hand, put a +1/+1 counter on that creature. (Whenever you cast a noncreature spell, a creature with prowess gets +1/+1 until end of turn.)
Flashback {3}{U} (You may cast this card from your graveyard for its flashback cost. Then exile it.)",uncommon,blb,3ff83ff7-e428-4ccc-8341-f223dab76bd1
Pearl of Wisdom,Sorcery,{2}{U},['U'],,,"This spell costs {1} less to cast if you control an Otter.
Draw two cards.",common,blb,13cb9575-1138-4f99-8e90-0eaf00bdf4a1
Run Away Together,Instant,{1}{U},['U'],,,Choose two target creatures controlled by different players. Return those creatures to their owners' hands.,common,blb,7cb7ec70-a5a4-4188-ba1a-e88b81bdbad0
Shoreline Looter,Creature — Rat Rogue,{1}{U},['U'],1,1,"Shoreline Looter can't be blocked.
Threshold — Whenever Shoreline Looter deals combat damage to a player, draw a card. Then discard a card unless seven or more cards are in your graveyard.",uncommon,blb,d5bf8cf0-419a-4dc9-9342-aad55c1af05a
Thought Shucker,Creature — Rat Rogue,{1}{U},['U'],1,3,Threshold — {1}{U}: Put a +1/+1 counter on Thought Shucker and draw a card. Activate only if seven or more cards are in your graveyard and only once.,common,blb,44b0d83b-cc41-4f82-892c-ef6d3293228a
